uid,name,url,movie_name,rating,comment
beattywell,毛毛毛男,https://www.douban.com/people/beattywell/,后会有期,推荐,it's  cool~
luerdelphic,luerdelphic,https://www.douban.com/people/luerdelphic/,后会有期,推荐,好笑，温情，帅到，基情，该有的都有了。。。。不滥情不硬嗑，剧情的冲突发展和流转都很流畅。几位主演太喜感了，所以虽然感动，倒也没哭出来，哈哈哈。华裔小哥哥真帅真甜真壮，给我来一百个好不好。。。
luzhiyu,陆支羽,https://www.douban.com/people/luzhiyu/,后会有期,还行,3.0。
ifanmu,梵目,https://www.douban.com/people/ifanmu/,后会有期,还行,关怀人生
64977335,feeling,https://www.douban.com/people/64977335/,后会有期,还行,影2099：他们的需求和尊严，需要给予。
stevecarell,基瑞尔,https://www.douban.com/people/stevecarell/,后会有期,还行,第N个版本和换一种搭配的“XX的愿望”，“兄弟们”“性尝试”“囧途”等固有套路一个不少，所以故事没有太多新意。但加分点在于没有刻意滥情，只是在很合适的时候给予角色命运与矛盾颇为自然的转折或是不间断抛出笑点（荤段子），完全是可以获得纯粹一乐的公路喜剧；还有《成长边缘》后，除去零散的电视剧客串外，很久很久都没看到司徒颂曦小哥了（快给我火！）。
kiki204629,kiki204629,https://www.douban.com/people/kiki204629/,后会有期,还行,他们只是想和普通人一样。虽然很囧，但很真实
fightim,横丫肠,https://www.douban.com/people/fightim/,后会有期,推荐,尋找尊嚴的性旅行，沒錯，性即尊嚴。
simpledragon,十六。,https://www.douban.com/people/simpledragon/,后会有期,推荐,有时侯，忘记好过非要去克服。对这群人来说，克服意味着不自由，意味着要以放弃尊严为代价去乞讨欲望。开局因冲动而上路，结局因想通而回到原点。没有什么改变，平静就是继续下去的最大力量。几个人配合的说唱是真好听。
53550852,蒙奇D,https://www.douban.com/people/53550852/,后会有期,还行,7分。我觉得这部电影里的华裔演员司徒颂曦更适合演尚气。又是一部带有悲剧色彩的喜剧，很好笑，是我的笑点，最后也挺好哭的。三个残疾人的性需求之旅，一个近乎全盲，一个全身瘫痪，一个下肢瘫痪，一个雇来的司机，一个临时的组合。最后他们不仅达到了目的，还收获了爱情、友情、久违的放松和做人的尊严。后会虽然无期了，可是离开的人给了剩下的人新的人生。看起来是很多前作电影基础上的改编，其实是真实事件改编的。
1001195,斯坦利•赵,https://www.douban.com/people/1001195/,后会有期,还行,女主真是又黑又胖。
fndxm,Wednesday,https://www.douban.com/people/fndxm/,后会有期,推荐,3+，翻拍自荷兰电影《人生最棒的旅程》，残疾人寻“爱”之旅。寻爱本身是一个典型事件，又代表着更广的诉求。残疾人除了弱势、自卑，还有来自家庭、亲人以爱为名的束缚，尤其后者敏感又复杂。影片用喜剧包装，从“偷偷”到无奈面对必须表达，处理的还不错，整体偏温情、美好
Rabit43127157,老怪CXJ,https://www.douban.com/people/Rabit43127157/,后会有期,还行,残障人士可以像正常人一样寻求性旅程。
79066552,Tom,https://www.douban.com/people/79066552/,后会有期,推荐,好的公路片永远让人感动
71128052,绝望的状态,https://www.douban.com/people/71128052/,后会有期,还行,小说豆瓣这次的不用心，简介都不用中文，其次，电影其实拍的还不错，虽然是残疾人士，但是他们追求性尊严的旅途，其实也是每个人寻求自我尊严的旅途，一个人非要到没有后路的时候才会想着改变，虽然有那么多的不公，那么多的不顺利，但是，当你真正去努力的时候，社会也会给你温暖的怀抱……
120274901,1号游客,https://www.douban.com/people/120274901/,后会有期,还行,充满人性关怀，这才应该叫后会无期吧，与《亲密治疗》同一题材，加入了公路剧情显得更有趣味，不过对白一般，亚裔男也不怎么讨喜，减弱了本该得5星。做完出来神清气爽得表情真逗乐我了。
may5may,无奇,https://www.douban.com/people/may5may/,后会有期,推荐,不知道为啥，看得我特别有感触
queenchelsea,pixiedust,https://www.douban.com/people/queenchelsea/,后会有期,还行,有一点儿难过呀
shegoChen,Red.,https://www.douban.com/people/shegoChen/,后会有期,推荐,片子里里外外透露着贫穷，导演也没把演员的演技激发到最好，但还是挺可爱的。海边那段感觉特别对
drinkfang,Drink,https://www.douban.com/people/drinkfang/,后会有期,还行,确实非常老套俗套，但是还挺感动的，For Freedom. 很喜欢里面那句回答：Let biology take over Don’t plan anything 
141078312,Xanax,https://www.douban.com/people/141078312/,后会有期,推荐,居然是真实事件改编。pubic hair和funeral rap还是蛮加分的。此外就是低配版的《阳光小美女》混合《性福疗程》，但是趣味度和表演上都过于表面化了。3星，为了人情味再来一星！
49854579,徐小乙,https://www.douban.com/people/49854579/,后会有期,还行,没拍过的题材
kp81ndlf,金利是个省油灯,https://www.douban.com/people/kp81ndlf/,后会有期,推荐,喜剧表象下的忧伤。很鲜明的设置，不用特别精巧的构思，也能直奔主题的意义。无论你是笑了，还是动容了。
54127855,咻咻,https://www.douban.com/people/54127855/,后会有期,推荐,很棒的一部电影，有搞笑之处也令人深思
york_wu,york,https://www.douban.com/people/york_wu/,后会有期,还行,让我想起了几年前海伦亨特演的那部严肃版的。
43892300,andredao,https://www.douban.com/people/43892300/,后会有期,,既有前作蓝本做底，又号称受到真实人物事迹激发，成色确实只算一般，但个人觉得冲着司徒颂曦，可以打到7分。而且这种这种破处之旅，国内都不能拍呢。
68020726,吃鱼爱好者,https://www.douban.com/people/68020726/,后会有期,推荐,“come”双关了吧。有点心酸，有点好笑。影片聚焦于特殊群体的特殊需求，很容易被大家忽视的需求。
68947670,路人甲先生,https://www.douban.com/people/68947670/,后会有期,推荐,和亲密关系一样探讨残障人士的性需求，只有我们互相平常对待直面需要才能感受到人生的尊严吧。司徒颂曦可不可以来找我。
145506949,海芋,https://www.douban.com/people/145506949/,后会有期,还行,电影还算还可以吧，尤其最后一幕泪奔，只是故事性还不强，没有多少新意。真实故事改编，多少还是能够打动人的。虽然他们看不到走不动，但是他们就像正常一样，需要尊严。
4374125,毛毛,https://www.douban.com/people/4374125/,后会有期,力荐,电影很有意义…
unfreedog9527,朗读者晟焕,https://www.douban.com/people/unfreedog9527/,后会有期,力荐,比起《人生最棒的旅程》来，此片有所延伸。破处之后并非永远振奋、激动人心下去。只是跨过一个门槛后，发现前面还有无数门槛。重要的是接受现实，在此基础上去发现自己的潜能。
46613572,Kwaidan怪谈,https://www.douban.com/people/46613572/,后会有期,还行,中规中矩
33749968,海边的土狗,https://www.douban.com/people/33749968/,后会有期,还行,很轻松的片，残疾人的生理需求，要知道我国也有几千万的残疾人啊！他们需要的可不仅仅是怜悯，过度渲染怜悯气息对这个群体真的一点都不好，路边乞讨那些假扮的也正是利用了这点
180382775,吃盼君,https://www.douban.com/people/180382775/,后会有期,推荐,看到最后的葬礼Rap听着听着就哭了 众生的我们都是平等的 从性这个角度切入更加真实 和韩国伟大的愿望也异曲同工 虽然我们有不同 但大家都是一样的人类 最后一点司徒太帅了！so fucking hot !
45858265,手欠不是两三天,https://www.douban.com/people/45858265/,后会有期,还行,司徒颂曦好看
3832255,4eyebrows,https://www.douban.com/people/3832255/,后会有期,推荐,不矫情，特别美好，人人都想放纵一把，公路电影不管是基于什么目的，认定了、出发了、完成了，都很美好
63422177,不老的李大爷耶,https://www.douban.com/people/63422177/,后会有期,还行,残疾人破处这种题材的电影看来也要像《完美陌生人》一样每个国家翻拍一遍了……原创的好故事越来越难产
Pius,Pius,https://www.douban.com/people/Pius/,后会有期,还行,看到最后哭得满心积极勇敢。
cy2941873,华尔街之汪,https://www.douban.com/people/cy2941873/,后会有期,推荐,标准公路喜剧，感觉比小小的愿望更好一点，但是笑点没有那个好
2374450,猪小新,https://www.douban.com/people/2374450/,后会有期,推荐,这个境界，真的。
129250300,野亦儒,https://www.douban.com/people/129250300/,后会有期,还行,boring
74049613,小强,https://www.douban.com/people/74049613/,后会有期,推荐,出乎意料的很棒
55509648,舔食者,https://www.douban.com/people/55509648/,后会有期,还行,太鸡汤了
64673199,杨卫东,https://www.douban.com/people/64673199/,后会有期,还行,最后关键时刻不拍了，差评！突然的死去有点让人不解，最后的rap真的好听
kokcw,Darren,https://www.douban.com/people/kokcw/,后会有期,较差,没有密集的笑点，就是消费一波person with disabilities
58287928,木兰,https://www.douban.com/people/58287928/,后会有期,还行,剧本套路和表演痕迹都很重的那种电影…但是边缘化人物的题材还是值得支持。
btone0808,麦子,https://www.douban.com/people/btone0808/,后会有期,还行,残疾身体的破处之旅，笑点建立在痛苦之上更有渲染力，导演处理的已经很美好了
150865336,一片熏肉,https://www.douban.com/people/150865336/,后会有期,还行,69/100  这部【破处之旅】有笑有泪。
yueryu,秋山,https://www.douban.com/people/yueryu/,后会有期,推荐,好看
79855798,侑,https://www.douban.com/people/79855798/,后会有期,推荐,看起来就是很舒服啊 多一星给教堂rapper
99336195,神经病庄十三,https://www.douban.com/people/99336195/,后会有期,推荐,寻找自我之旅。
manualin,单纯de叛逆,https://www.douban.com/people/manualin/,后会有期,较差,蛮无聊的电影，还有电影名称翻译的啥破玩意。
139790630,遂古,https://www.douban.com/people/139790630/,后会有期,很差,美国版伟大愿望？
161159221,港呢啲,https://www.douban.com/people/161159221/,后会有期,推荐,一段破处之（囧途）旅，和韩国那版有相同之处（秒杀了彭昱畅王大陆那版弱智儿童）。最后肌肉哥死了有点太过抓马……
70638563,懒散柴郡猫,https://www.douban.com/people/70638563/,后会有期,力荐,太暖了吧？居然是真实事件改编。万恶的资本主义社会啊。看得我一会泪崩一会傻笑，身残志坚版《飞虎出征》。生活的痛吻，报之以歌。可惜你们永远不会懂。
eddychaw,B-B-B,https://www.douban.com/people/eddychaw/,后会有期,很差,在大力强调diversity的今天，全部的剧和电影都要用真实有缺陷/残疾的演员来饰演。这部电影很勇敢啊，全部让正常人来扮演残疾人。。
benlovingmusic,benlovingmusic,https://www.douban.com/people/benlovingmusic/,后会有期,推荐,性即尊敬！
52464177,Yee,https://www.douban.com/people/52464177/,后会有期,较差,还行吧，没看过原版不好比较。it is kind of empty这是说对了
132008640,南安苏乔,https://www.douban.com/people/132008640/,后会有期,还行,挺好。
liangjingyu,独钓寒江雪,https://www.douban.com/people/liangjingyu/,后会有期,较差,翻拍的没有原版更有代入感
wheatkittymew,明媚,https://www.douban.com/people/wheatkittymew/,后会有期,较差,开头还行，越看越没劲。残疾人寻爱题材不错，但是剧本实在是一般。
76697169,Pesce morto 🐡,https://www.douban.com/people/76697169/,后会有期,推荐,教堂那段rap太酷了
riverbird,凭栏听雨,https://www.douban.com/people/riverbird/,后会有期,还行,把嫖妓说成人生转折也是醉了。
54738477,夏日嬷嬷茶,https://www.douban.com/people/54738477/,后会有期,还行,还算是脉脉温情 看的版本翻译的不行
3752454,摩尔乌鸦,https://www.douban.com/people/3752454/,后会有期,还行,剧情稍显单调了一些
156004679,丙十二耗叔,https://www.douban.com/people/156004679/,后会有期,还行,过于残缺的还是有点不适应啊~
79796200,奇迹小子,https://www.douban.com/people/79796200/,后会有期,推荐,健康的笑点，温情的故事，特殊人群的关照，自然真实不矫情的好电影！
55430358,AI,https://www.douban.com/people/55430358/,后会有期,较差,just dont feel comfortable about all this buy sex thing.
mrcoolchina,06 Mr. Cool,https://www.douban.com/people/mrcoolchina/,后会有期,推荐,大哥最后扔话筒的桥段挺逗
nmgfgq,富员外,https://www.douban.com/people/nmgfgq/,后会有期,还行,故事性、趣味性、配乐都好于原作，演员则差点意思，最关键的是没有点题
190708671,郡君,https://www.douban.com/people/190708671/,后会有期,还行,三位主人公是一名盲人，一名半身瘫痪着和一名全身瘫患者，但是他们相信，像他们这样的人也有权利追求爱和性，所以三人本着“破处”的目的向着蒙特利尔一家为残疾人提供服务的地方出发了。
175742580,柠檬手链,https://www.douban.com/people/175742580/,后会有期,还行,有不少类似的寻找性自由的电影，本片前戏过长，笑点不算多，人物成长也一般，但是胜在气氛不哀不伤，比较积极向上。
133255336,悟空FM,https://www.douban.com/people/133255336/,后会有期,还行,一部特殊的公路片。
zxy20150621,张轩洋,https://www.douban.com/people/zxy20150621/,后会有期,推荐,看这部电影的时候，让我想起了韩国版的《伟大的愿望》，有喜剧，有感动。唯一不同的是，这个故事里的三位主角都是残疾人，他们很勇敢，为了不留下人生遗憾，一起踏上了一次特殊的“长途旅行”。
68412162,thesame,https://www.douban.com/people/68412162/,后会有期,还行,开车的一段还是令人深刻，还有这会引发人思考，可惜电影整体一般
46524183,MrCondom,https://www.douban.com/people/46524183/,后会有期,推荐,唯有正视人性才能面对操蛋的人生吧
160348366,贝影,https://www.douban.com/people/160348366/,后会有期,还行,有意思的关怀种族和残障人士的电影。
41369322,EaTing·sTOOLs,https://www.douban.com/people/41369322/,后会有期,还行,结尾教堂那一段确实感动到我了
kissofdead,KissofDead,https://www.douban.com/people/kissofdead/,后会有期,还行,Haste la vista
sclube,肉卷先生,https://www.douban.com/people/sclube/,后会有期,推荐,太干净了
133090051,藤椒可乐,https://www.douban.com/people/133090051/,后会有期,推荐,3.5拍得挺有趣，比中韩版《伟大的愿望》好。欧美的残疾人保障本就健全，但不禁又想，女性的生理需求怎么办？
mouse520fox,暴走的乔巴,https://www.douban.com/people/mouse520fox/,后会有期,推荐,还是第一次看这种关于特殊群体的电影，很特别。台词和剧情都有让人捧腹大笑的点，更难得的是故事源于人物真实事件。
sunxjlovepeace,count,https://www.douban.com/people/sunxjlovepeace/,后会有期,推荐,就想知道Matt到底得了啥病
JonathanGun,棍儿,https://www.douban.com/people/JonathanGun/,后会有期,推荐,"笑中带泪,还不错~"
132295742,。。。,https://www.douban.com/people/132295742/,后会有期,还行,少见的各个方面都值三颗星的神奇片子
1798295,Gary,https://www.douban.com/people/1798295/,后会有期,还行,翻拍的公路故事，还是很温馨的，关注小众人群的生活
58802323,我想你没有,https://www.douban.com/people/58802323/,后会有期,推荐,原本以为是瘸子，瞎子和断臂的囧途，结果误解了，三个处男的寻欢之旅，残疾人不是残废，他们也想拥有正常人的生活，吉特鼻下那颗痣，太像鼻屎了#后会有期# #电影#
laqipingping,腊七～萍,https://www.douban.com/people/laqipingping/,后会有期,推荐,坦诚 很重要。（PS：马特超帅超有型，还专门去百度了，叫 司徒颂曦，85年的小哥哥）
yangyangjiang,泱泱酱,https://www.douban.com/people/yangyangjiang/,后会有期,推荐,好在！特殊人群却表达出了普通人群一样的情感问题。人人平等，谁都有烦恼。剧情不算出人意料，但莫名的能让人看下去，不令人厌感。角色人物找的好。
171765281,濑户内海,https://www.douban.com/people/171765281/,后会有期,推荐,中间有段Rap有点像j cole
artmanagement,云端飘飘,https://www.douban.com/people/artmanagement/,后会有期,还行,Love and sex with dignity.
xiaoweixw,Verywrong,https://www.douban.com/people/xiaoweixw/,后会有期,还行,三星半 虽然cliche就还…surprisingly蛮好笑的
206800456,一米称王,https://www.douban.com/people/206800456/,后会有期,推荐,小众电影吗？故事流畅不拖沓，很容易进情绪！
189089885,hehe,https://www.douban.com/people/189089885/,后会有期,力荐,最后的RAP挺好听
143854646,Max,https://www.douban.com/people/143854646/,后会有期,推荐,配乐加星，说唱加星。
68331002,我要说下话！,https://www.douban.com/people/68331002/,后会有期,推荐,还不错，没看过原版，美版也不错。
145223474,Monica,https://www.douban.com/people/145223474/,后会有期,还行,葬礼rap……
71789119,查理,https://www.douban.com/people/71789119/,后会有期,推荐,三个不同种族的残疾人为了自己的性需求去往Montreal的公路之旅。结局Matt旅途终点，Mo收获了真爱，Scotty重得人生意义。片尾落在他们三在Matt葬礼上唱了一首歌，轻松、欢快，没有泪点。是终点也是开始。
59378291,游走精灵,https://www.douban.com/people/59378291/,后会有期,还行,还好
75435093,树,https://www.douban.com/people/75435093/,后会有期,较差,有关残障人士的特殊关怀，可以看看“手天使”这个公益项目。电影有点冗长拖沓…
sdotter,飂,https://www.douban.com/people/sdotter/,后会有期,较差,点子不错，完成得太平庸，昏昏欲睡
138058789,影视圈前沿观察,https://www.douban.com/people/138058789/,后会有期,还行,翻拍自比利时电影《哈斯塔维斯塔》。也是一部类似《伟大的愿望》的电影。讲一个腿脚残疾身患绝症的残疾人和他两个朋友（一个同样腿脚残疾和一个视力障碍）雇了一个性格暴烈的黑人护工女司机，请她开车去蒙特利尔妓院，实现自己在性方面的心愿的喜剧。这个设置其实有许多的喜剧空间，可惜的是处理的并不好，显得缺乏真正的高潮，能让人捧腹的喜剧点也比较欠缺。
34653772,冷月无声,https://www.douban.com/people/34653772/,后会有期,推荐,影片将镜头对准了特殊人群—残障人士，借助残疾人对性的追求，表达他们作为人的正常生理诉求和渴望被尊重、希望独立追求自我完善的愿望。关注弱势群体的电影并不多，此片既没有大打“悲惨牌”博取同情，也没有刻意输出“身残志坚”的滥俗鸡汤，而是真正将特殊群体置于和正常人一样的地位，展现他们最真实的心态和想法，配乐节奏把握得恰到好处，动静相宜。一个细节：大部分时候镜头都采用低位拍摄，与坐轮椅的主人公们的眼睛齐平或更低，无形当中避免了“居高临下”的上帝视角，悄然彰显平等的理念。
crowsz,孙打折,https://www.douban.com/people/crowsz/,后会有期,还行,Just so-so
26721122,仙女要喝露水,https://www.douban.com/people/26721122/,后会有期,还行,这个想法有点独特
143848068,fruitspunchc,https://www.douban.com/people/143848068/,后会有期,推荐,很有诚意的聚焦残障人士的公路片。笑点泪点都有，很是温暖。喜欢片名“Come As You Are”，接受自我，拥抱本我。
178747589,木头2014,https://www.douban.com/people/178747589/,后会有期,,1.95-Mp4Ba + 1.49zyyzlm
150940966,瓷猫猫,https://www.douban.com/people/150940966/,后会有期,还行,标记
171970155,blythe,https://www.douban.com/people/171970155/,后会有期,推荐,和日本的《37秒》是一个题材的电影，是残疾人寻求尊严的一场旅行，也是关于残疾人想和健全人一样对于「性」的追求，就像结尾的台词「即使坐在轮椅上 我也是自由的」。还蛮感人的
134382898,garnet123,https://www.douban.com/people/134382898/,后会有期,推荐,说不上身残志坚，但至少没有自怨自艾，敢于实现自己有点龌龊的理想就是好样的。
205896160,南风喃,https://www.douban.com/people/205896160/,后会有期,推荐,该有的都有了
63282326,cheermc,https://www.douban.com/people/63282326/,后会有期,还行,前半段想起了宿醉，后半段故事性急剧减弱，开始套路式的煽情，落差有点大。
67026438,ladybug,https://www.douban.com/people/67026438/,后会有期,还行,rap句号
187561423,瓊光蛋,https://www.douban.com/people/187561423/,后会有期,推荐,海邊那一幕好心疼啊。
192944705,面朝大海,https://www.douban.com/people/192944705/,后会有期,还行,"残疾人破处之旅，剧情拖沓，也是醉了
音乐不错"
134496411,Lindsay-z,https://www.douban.com/people/134496411/,后会有期,还行,剧情虽然没有啥新意，不过拍的挺真诚的.没有刻意催泪博取同情.司徒颂曦挺帅的.
33324943,tain,https://www.douban.com/people/33324943/,后会有期,力荐,好好看呀，怎么评分那么低！煽情控制得很好！Fight for dignity!
37424688,Justin,https://www.douban.com/people/37424688/,后会有期,还行,公路电影，结局有些悲了。
chinaliuba,chinaliuba,https://www.douban.com/people/chinaliuba/,后会有期,推荐,导演是个华裔，讲三男主一个特殊的小旅程，反应残疾人士的生活。很多好笑的点很逗，但看完也很有反思，觉得我们拥有的人生真是很幸运。课外话就是美国对于残疾人尊重和提供就业和残疾人生活方便设施已经是全世界非常好的，残疾人可以开车，就业，走在马路上也很少人会另眼相看，但他们内心才是人们最应该关心的。
46735351,程广宇,https://www.douban.com/people/46735351/,后会有期,推荐,这个，很好的选材，拍的算是很好了，毕竟制作费用有限吧。。结局也不错，nice movie
193102434,美版monster饮,https://www.douban.com/people/193102434/,后会有期,很差,又不好笑又无聊又没劲
88047403,Update,https://www.douban.com/people/88047403/,后会有期,推荐,是我过了那个年纪吗，没有被感动或者觉得太好笑，除了最后一幕，灵堂Rap，哈哈哈哈哈哈
128468373,自由天禄,https://www.douban.com/people/128468373/,后会有期,还行,看完电影只想评论come as you are
205257853,做条快乐的咸鱼,https://www.douban.com/people/205257853/,后会有期,推荐,挺不错的一部片子 制作上也是花了心思的  四星送上
130647894,Superpanda,https://www.douban.com/people/130647894/,后会有期,推荐,"都是可爱的人
缺陷谁没有？"
157953136,星期五,https://www.douban.com/people/157953136/,后会有期,很差,有几分《极右青年》的屌丝气息也有几分《触不可及》的伤感，缺憾是演员都不怎么会演，剧情拖沓 没有太大意义。
113204223,著名杠精人士,https://www.douban.com/people/113204223/,后会有期,较差,加上用在路上多花费的钱在本地找绝对可以找到成色或者服务更好的
rechyo,Steven,https://www.douban.com/people/rechyo/,后会有期,还行,我猜原版更好看
50880029,路小诗,https://www.douban.com/people/50880029/,后会有期,推荐,it’s got a Canadian connection. Brothel Château Paradis in Montréal. 
150534311,老郝,https://www.douban.com/people/150534311/,后会有期,推荐,元素挺多的。挺有意思
171711875,兔子座,https://www.douban.com/people/171711875/,后会有期,还行,一般
47518001,Ytiiq,https://www.douban.com/people/47518001/,后会有期,还行,美帝的残疾人真特么幸福！
161794804,书生念山猫,https://www.douban.com/people/161794804/,后会有期,推荐,最近才看的，剧情挺好的，看完很有感触
182049727,金所炫,https://www.douban.com/people/182049727/,后会有期,推荐,引人深思
73191411,嗷嗷呜不是胖猫,https://www.douban.com/people/73191411/,后会有期,还行,3.5 
78486968,PLATO空想家,https://www.douban.com/people/78486968/,后会有期,力荐,这个题材请再多一点 请多关注这类人
194179290,红太狼,https://www.douban.com/people/194179290/,后会有期,还行,赞赞赞
210394224,ertugfdhhdbn,https://www.douban.com/people/210394224/,后会有期,还行,一般般
200988330,好可爱的贝塔,https://www.douban.com/people/200988330/,后会有期,推荐,很流畅
cuitaoqin,流浪的吹西,https://www.douban.com/people/cuitaoqin/,后会有期,还行,就公路片该有的样子：偷摸着上路 路上总有人想堵你 🤷‍♀️
